Title,Link,Description,Answers
"Taking google's python it automation course on coursera, looking for advice on what to do after",https://www.reddit.com/r/PinoyProgrammer/comments/z3hwek/taking_googles_python_it_automation_course_on/,"(repost from r/TechCareerShifter since I didn't get responses there)I'm halfway through this certificate program (Google IT Automation with Python Professional Certificate) specifically.(I should also mention I did not finish my degree in HRIM, and I'm looking into this kasi di na ako makakashift within my uni and di ko talaga alam kung gusto ko tapusin program ko)Curious lang ako, sapat na ba yung ganitong certificate to get a job as a junior/apprentice python dev? From what I read the answer is probably ""haha no"" pero kung ganoon, what would you suggest to make myself look more appealing to potential employers? I hear stuff about contributing to projects on github to build up experience but that sounds kind of vague to me as someone with zero experience before taking this course.I'm also looking into taking this course for full-stack software dev from IBM, would it be helpful for trying to land a job? Sorry if these questions sound dumb, but I really don't know where to start hahaha","['Just keep applying for jobs even as you learn. Getting a job is a numbers game. IMHO, apply to 30 jobs a day for 30 days.Also, try to get freelance gigs. Those are easier to get and it will give you some experience on actual projects.Kahit libreng pagawa ng website ng kapit bahay mo, Wala namang makakalam na libre lang yun e. Hehehe', 'learning without applying is useless, as other OP said, after what you learn, what you can offer?, have you try to apply what you learn', 'I have a certificate from coursera (IOT) pero feeling ko mababaw siya kung bilang palit sa degree or Bragging rights lang man.Siguro to be appealing sa mga company , create a program, app etc na pwede mo maidemo or maipakita sa kanila to showcase your capability.', 'what would you suggest to make myself look more appealing to potential employers?For entry level company jobs or even for freelance....definitely, portfolio.No idea what projects to do?  Just Youtube it.  Type ""python automation projects"".', 'Answer this: After you finished that course and get that shiny certificate — what can you offer based on what you’ve learned?If you can’t answer that, then I hate to break it to you but you are putting yourself in the world of pain. 😂Kidding aside, don’t think too much just focus on learning things. Certificate alone won’t gonna cut it.', 'learn basic databases OP (excel or NoSQL)or basic HTML, CSS, JS tapos apply mo po yung natutunan mo sa Python, tapos highlight mo po how you use Python on that website or databaseBale yan po magiging laman ng portfolio mo']"
How RPA and Artificial Intelligence combination builds end-to-end automation,https://www.reddit.com/r/DevTo/comments/wxad8d/how_rpa_and_artificial_intelligence_combination/,,[]
"Having a smart home & looking like a dumbass for standing in a friend’s kitchen repeating, “Turn on the kitchen lights” before being reminded their house isn’t automated, so I have to first find the wall switch & then physically alter its position. How inconvenient.",https://www.reddit.com/r/firstworldproblems/comments/wdfqp3/having_a_smart_home_looking_like_a_dumbass_for/,,"['Best way to handle appearances: Let out a heavy sigh and give a pointed look at the homeowner as you turn on the light.', 'I did this an a hotel room a few weeks ago! You are not alone.', 'Too wordy', 'Alexa, zip it.']"
how to automate screen brightness level based on light luminous from webcam?,https://www.reddit.com/r/Windows11/comments/ycpaif/how_to_automate_screen_brightness_level_based_on/,How to please?,[]
"Senior Manager, Email Marketing Automation @ WebMD",https://www.reddit.com/r/EmailJobs/comments/uyxlzx/senior_manager_email_marketing_automation_webmd/,"📨 New job: Senior Manager, Email Marketing Automation @ WebMD👉 Read more @ https://www.emailjobs.io/jobs/senior-manager-email-marketing-automation-at-webmd",[]
"How to use a DSLR camera as a ""web cam"" for live streaming?",https://www.reddit.com/r/NoStupidQuestions/comments/z188pv/how_to_use_a_dslr_camera_as_a_web_cam_for_live/,"I want to do a live stream around the holidays (playing my guitar) and I kmow theres a way to use a DSLR camera to record a live stream by connecting it to a computer, I've been trying anything I can think of and I did get a capture card (a cheap one since Im broke) to try that, and nothing. Would love some help, thanks!","[""i don't have a DSLR but if it connects to a monitor or such via micro or mini HDMI you could hook it up to a capture card via a cable, my camcorder let's me do it""]"
How to do LinkedIn automation without spamming?,https://www.reddit.com/r/marketing/comments/w3mt0j/how_to_do_linkedin_automation_without_spamming/,"LinkedIn automation tools are wonderful for locating new prospects and then developing relationships. With the right technology, users may search for and locate qualified persons to add to their sales funnel.Certain leads may be eliminated quickly as a result of this. LinkedIn automation tools can save you a lot of time. You don’t want to waste any of the 8 to 10 hours of a workday on a potentially unsuccessful new venture.Establishing and using LinkedIn automation tools takes only a few minutes per day. The case that individuals use LinkedIn to connect with others distinguishes it. They’ve already got entry. A LinkedIn invitation is significantly more reachable than an email or a cold call.Users can build customized messages with stand-ins for up to 100 new invitations to be issued immediately using the LinkedIn automation application Linkedcamp. It also allows you to schedule follow-up messages, which eliminates the need to manually process follow-ups with much more than 100 contacts — which is time-consuming if they don’t respond.Users can focus on connecting with customers and building relationships. Linkedcamp prevents being “spammy” because of its personalized approach, which boosts the possibility of attracting qualified leads.","[""If this post doesn't follow the rules report it to the mods.I am a bot, and this action was performed automatically. Please contact the moderators of this subreddit if you have any questions or concerns."", ""I always automate everything - on every platform possible. But LinkedIn isn't one of them - at least when using your professional profile. The stakes of being banned are too high. LinkedIn automation works only when you make your tool - not for commercial tools. LinkedIn employees buy these available for everyone's software and make them useless by tracing its footsteps on the net and when someone uses them - the system instantly bans them because they use the same steps on platform as the automation would.""]"
How long should it take to learn flask decently? I feel I am going to slow it been a few months over a year. I also added pytesting to my code. Is that embarrassingly slow. I knew about coding but nothing about web development. I didn't even know what a try or a class were. Thanks.,https://www.reddit.com/r/flask/comments/yfes4b/how_long_should_it_take_to_learn_flask_decently_i/,,"['I’m no flask expert, but I think the ‘right speed’ is the one that achieves your goals. Nobody here knows your life and your challenges.If you are able to do the projects you want to do, then no - you’re going the right speed! If you intend to be employable then you should take a broader view than just flask and figure out the scope of what you’ll need to learn and think about how long you’re willing to wait to get there.What are your goals for flask?', '+1 to this. I see so many people with the mindset  that learning a language / framework is a fixed goal. As though if they learn a, b, and c then they\'ve ""learned"" the language / framework and that box is forever ticked.In reality, there\'s always more to learn so the mindset should be focused on what you\'re capable of doing.', ""My goals are to build an original website with flask. I don't want to go into the exact details because someone could then take my idea. The website should not even need file uploads but will need a few other features . Currently I am working on a blog where a lot of the features will be needed. I am using some of the tutorials pinned at the top. I notice I mostly try to read the tutorials then try write most of the code without looking at the tutorials unless I am stuck.Eventually I would want to create other ideas maybe in other language and maybe learn about apis using flask."", 'It\'s hard to define what ""learn Flask decently"" would even mean. Strictly speaking, Flask itself is quite limited in scope. It is a small component in a very large web of technologies, concepts, and skills that make up web development. When people say they\'re struggling to ""learn Flask"", it\'s often true that they\'re actually struggling with Python, or Jinja, or CSS, or programming paradigms, or reasoning about how HTTP request-response works, or database design, or an ORM, and so on and so on. If you\'re starting from light programming knowledge, and no web development knowledge, you have to first become familiar with all the myriad things that allow you to work with Flask, not just Flask.And that\'s not even getting into the context of how you\'re using Flask, i.e. what you\'re specifically trying to build. I\'ve used Flask professionally every day for years, but there are plenty of categories of webdev problems to solve that I\'ve never dealt with, because they\'ve never come up for me. Every new project has some challenge — some new thing to figure out — and always a few missteps. It\'s important to remember that programming isn\'t about the tools, it\'s about problem-solving; so realistically there\'s no point at which you\'re ""done learning"" XYZ and it\'s smooth sailing from then on.So all that said, I think your question more accurately boils down to ""how long does it take to become reasonably proficient in web development?"". And a year or more is not unreasonable at all if you\'re starting from minimal knowledge. But it\'s impossible to say how long it should take, because it entirely depends on what you\'re trying to do (now, and in the future) and where you\'re starting from.']"
Is there a way to automate the killing of excess plug slugs?,https://www.reddit.com/r/Oxygennotincluded/comments/zhsr59/is_there_a_way_to_automate_the_killing_of_excess/,"I've been tinkering with a system that keeps full grown slugs ready to replace the elderly ones when they die, & automatically send them to the ranch when it needs more slugs. I can't seem to find a good way of automatically killing excess slugs for meat however. You can't drown them. The wiki says their livable range is up to 70°c, but through testing temperature seemed to have no effect. Any tips?Edit: 76°c crude oil seemed to have killed them after about 3 10 cycles. Now I gotta figure out how to get them in itEdit 2: Temperature definitely affects them, they just transfer temperature pretty slowly. I'm playing around with using a cobalt volcano to heat a kill room while also producing food for them :)","[""Maybe you're overthinking it. Inside a drowning chamber they might not drown, but they'll definitively starve. So it just takes longer for them to turn to meat, but you'll definitively end up with the same calories/cycle as hatches because what matters is egg/cycle production.EDIT: Hell, you can take it up a notch from this. I bet that if you send the eggs to an open-to-the-world floating island you can still get some power out of the soon-to-starve Pluglets and Plug Slugs. They lose their power over time as they lose calories but you squeeze til they're dry. Then it's just a matter of collecting the meat with sweepers."", 'Over time I ended up with a sponge egg getting in my drowning chamber which took away the water.', 'FIRE!', 'Closed box full of tempurature controlled oil and a rail dropping the eggs in and a sweeper for the meat?', 'there is a special place in hell for you! slugs are cutest !', 'As others have advised - just create a “Dying Grounds” ranch of misery.No foodNo population limit', 'This elderly category will sadly be used mostly by folks like op. To send the oldies to die after they can no longer reproduce.', ""There is a mod called butcher/fishing station that allows you to ''handle'' excess critters and older critters in general, is an easyer evolution chamber and gives you extra meat according to the rancher's skill"", 'I use this and feel it should be in the base game', 'Wait, plug slugs don’t drown like dreckos do?', 'nope, you even have a chance of them laying a mop slug egg when they are submerged', ""Sorta (un)related question, but how and when do I use Plug Slugs? I've never used them."", ""Plug slugs (original breed) eat metal (both ore and refined) and give off hydrogen gas when they eat.When they sleep at night they hang from any suitable ceiling tile and produce power, the amount produced varying depending on if they have eaten recently. If you run a power wire connected to a bank of batteries through all the tiles where their connection points might be you can get quite a bit of power out of them. The last time i used them they still produce some power even without feeding them at all, so trapping a few wild ones in a room with no food is a no-lose proposition, ie. a small amount of free power for no cost whatsoeverThe new breeds (recently released) do other things, but I've not used them yet so won't comment on them."", ""I haven't designed any setup yet. But when I do, the plan I have is to use 2 ranches. 1 for breeding, where I just keep two, and another ranch where they don't get groomed, where I use them for drawing power.Edit for clarification:The reason for this setup is that ungroomed/glum slugs only eat 10% food, but still produce full power. And the breeders get groomed and fed so they will produce lots of eggs, which get sent to the other farm, unless there's less than 2 slugs in the breeding farm."", 'Seems like a heated or chilled “drowning” room would do. I’d just reuse an aqua tuner steam room as a kill chamber.', 'You could use radbolts to do the thing. Even small portions deal significant damage', ""Or just dump them in a room to starvation ranch. They'll continue to trickle power even if they haven't eaten 🤷\u200d♀️I basically use slugs wild as bonus power, because I haven't had a seed yet where I needed to use them otherwise. The new variants are handy little slow pumps you don't have to power, too."", ""I basically use slugs wild as bonus power, because I haven't had a seed yet where I needed to use them otherwise.Perhaps it's just the world gen I got, but starting on a swampy metallic asteroid will definitely steer you heavily in the direction of plug slugs. There isn't much else for power otherwise until natural gas comes in, other than the hamster wheel or hydrogen from a SPOM. I think a hydrogen vent can spawn too, though my world doesn't have one.The new variants are handy little slow pumps you don't have to power, too.""]"
How vildhjarta automates pitch shifting to write riffs (lavender haze cover),https://www.reddit.com/r/vildhjarta/comments/wbvgub/how_vildhjarta_automates_pitch_shifting_to_write/,,"['Damn I never realized that one harmonic was pitched differently from the chugs it exists between. Playing like this seems super difficult though, you have to be absolutely perfectly on time for it to work. The accuracy of our boys is insane.', ""Machine-like precision is key. In an episode of the Riffhard podcast, Buster Odeholm said that all the guitar parts are highly edited to make the timing as perfect as possible.It isn't necessarily as hard to physically play as it is to fully internalize what's going on technically and musically, and for that to fully sink in. Once you get a feel for how automated pitch shifting changes your available notes, it feels actually quite natural."", 'Nice! What did you do for drums?', 'The part you recorded for this has to be my favorite motif on the record.', 'Stems?🥺', 'This is interesting.  When you say pitch shift -5… are you saying 5 half steps?  5 whole steps?', 'Usually 5 semitones, so yeah half steps', 'Aww man that is so cool. So with this being that much harder to play accurately, how does it sound live?']"
How to automate checking many web pages for updates ?,https://www.reddit.com/r/webdev/comments/fiuycd/how_to_automate_checking_many_web_pages_for/,"Hello, is there an automated way to notify/check when web page has been updated ?Could do this easily on Pages that had RSS ...  but most pages On my list don’t have itCheers","[""A few minutes of Googling gave me this:http://visualping.io/I don't know if this works well :)But, I think that this topic is quite hard. Is a simple 2 pixel padding change considered as a change from your point of view? Or, is this related to the textual content?"", ""I'd suggest using beautifulsoup and wiring a small python program. You can integrate it with slack to get notifications as well (I have a few applications built that do similar functions - shouldn't take more than a week to get it built and live)""]"
Generic Web Scraper using browser automation?,https://www.reddit.com/r/learnprogramming/comments/tvecoj/generic_web_scraper_using_browser_automation/,"Hi everyone,I'm trying to build browser automation based generic web scraper using Selenium or Playwright in Python.Something like DataGrab.io (https://youtu.be/uu8l44eudfA) or parsehub (https://www.parsehub.com/) or webscraper.io (https://webscraper.io/)Are there any open source implementation of the same, not exact the same but at least some starting point? I'm currently only exploring the implementation part and not considering the proxy and IP rotation etc.Thanks","['if this helps : https://medium.com/@nafis-ahmad0087/how-to-scrape-news-articles-with-specific-words-2b79984bdd95', ""Thanks for sharing the link but it is not something I was looking for, it's using requests which works only for static websites. Actually, I am aware of scraping implementation but it's that I am looking for some kind of boilerplate project that uses either selenium or playwright to develop generic browser automation based scraper."", 'r/AutomateYourself']"
Shot Scraper – How to automate website screen capture?,https://www.reddit.com/r/easy_tutorials/comments/xz5tqn/shot_scraper_how_to_automate_website_screen/,,[]
How to automate an offer workflow,https://www.reddit.com/r/vba/comments/wa8010/how_to_automate_an_offer_workflow/,"I am looking for an entry point to automate a specific workflow in my company.My google search shows me different ways of how to try it - but not being an advanced user for this task, it leaves me with ? which way to go best.I try to explain the task in few words:we receive an email from a customer asking for a quotation for a specific product. Its always a scanned PDF, for 1 to 4 different products. There is a combination of handwritten remarks etc thus quotation needs to be manually processed.once a human has processed the data (i.e. checked availability, price, delivery details like coolchain requirements etc) the process which I want to automate starts.In a template, information from the quotation is entered:- quotation number/reference and deadline for submission- product details like manufacturer, SKU details, unit price, total price, country of originthe quotation is saved as PDF; File name is equal to quotation referencethe pdf is attached to an email. the TO is alwatys the same central customer address, email subject must be the quotation number/reference and deadline for submissionI would like to speed up the steps 3 & 4Do not expect to receive a full solution here - but a hint which way would be the easiest to do this in a simple environment.Posted the same in Excel, but realize that VBA is probably the answer -which still leaves me with the question - where to start?appreciate hints & help","['No one is going to be able to give you any useful advice with this level of information. Except for the fact that it would be easy to automate step 5 also.', 'thanks,you might be right - I will talk with a VBA experienced colleague & will come back for specific support', 'So I made something similar in VBA a few years ago.Wrote a macro that scanned all incoming emails (it was a shared email account and only for that) and looked for the right things (keywords and/or attachments). Once it found something that met the criteria it triggered another program.If you have a standard form that people fill out you could try using some ocr to automate this or at least extract it for the human to process it in a more efficient manor.', 'the template is called a userform... google how to make those...then google how to make a report based on the userformthen google how to save as pdf and you should be golden :-)', 'Thank you, will do', ""Thanks for the direction.Now I run into a specifc issue. The code below is running on some WIN machines in the office - but not on mine. It stops with an error before generating the PDF. With a colleague it does exactly what I wanted - prints a PDF & attaches it to an emailHere is where it stops'Save as PDF file"", ""It looks like you're trying to share a code block but you've formatted it as Inline Code. Please refer to these instructions to learn how to correctly format code blocks on Reddit.I am a bot, and this action was performed automatically. Please contact the moderators of this subreddit if you have any questions or concerns."", 'issue solved -  posting for future referenceDate settings vary between our computers. I was the only one using dd/mm/yyyyEveryone else was on dd.mm.yyyyMy setting caused the issue.']"
"Hello everyone, how can I get power bi to use the latest email to get the attached report from that latest email on daily basis automation???",https://www.reddit.com/r/PowerBI/comments/u1jc8d/hello_everyone_how_can_i_get_power_bi_to_use_the/,,"['I use power automate to grab attachments from my daily report emails, and place them in a folder which is connected to powerbi. Schedule an auto refresh and you’ll be on your way.', ""How did you set up auto refresh?I am struggling with gateway, I am not sure if its my company security settings (I am far from having admin rights), or I just can't figure out."", 'Use email teams chanel function. Make sure it us enabled in your tenant. Get your email sent to the teams chanel. Teams will autosave the attachment to sharepoint. Pick it up with the sharepoint connector and either import all from folder or sort by created date and take the latest file. Simples.', 'Not sure if it’s what you’re looking for but you can point a paginated report at the underlying dataset of a regular PowerBI report then use power automate to refresh it and pull content out of the paginated report in csv form which in turn can be stitched into an email. Schedule the flow to run after your BI updates and you’re good', 'I set a solution up for a friend with low permissions where a google app script writes the latest email attachment to google sheets and then built a PBI report on that.']"
