Title,Link,Description,Answers
How long should it take to learn flask decently? I feel I am going to slow it been a few months over a year. I also added pytesting to my code. Is that embarrassingly slow. I knew about coding but nothing about web development. I didn't even know what a try or a class were. Thanks.,https://www.reddit.com/r/flask/comments/yfes4b/how_long_should_it_take_to_learn_flask_decently_i/,,"['I’m no flask expert, but I think the ‘right speed’ is the one that achieves your goals. Nobody here knows your life and your challenges.If you are able to do the projects you want to do, then no - you’re going the right speed! If you intend to be employable then you should take a broader view than just flask and figure out the scope of what you’ll need to learn and think about how long you’re willing to wait to get there.What are your goals for flask?', '+1 to this. I see so many people with the mindset  that learning a language / framework is a fixed goal. As though if they learn a, b, and c then they\'ve ""learned"" the language / framework and that box is forever ticked.In reality, there\'s always more to learn so the mindset should be focused on what you\'re capable of doing.', ""My goals are to build an original website with flask. I don't want to go into the exact details because someone could then take my idea. The website should not even need file uploads but will need a few other features . Currently I am working on a blog where a lot of the features will be needed. I am using some of the tutorials pinned at the top. I notice I mostly try to read the tutorials then try write most of the code without looking at the tutorials unless I am stuck.Eventually I would want to create other ideas maybe in other language and maybe learn about apis using flask."", 'It\'s hard to define what ""learn Flask decently"" would even mean. Strictly speaking, Flask itself is quite limited in scope. It is a small component in a very large web of technologies, concepts, and skills that make up web development. When people say they\'re struggling to ""learn Flask"", it\'s often true that they\'re actually struggling with Python, or Jinja, or CSS, or programming paradigms, or reasoning about how HTTP request-response works, or database design, or an ORM, and so on and so on. If you\'re starting from light programming knowledge, and no web development knowledge, you have to first become familiar with all the myriad things that allow you to work with Flask, not just Flask.And that\'s not even getting into the context of how you\'re using Flask, i.e. what you\'re specifically trying to build. I\'ve used Flask professionally every day for years, but there are plenty of categories of webdev problems to solve that I\'ve never dealt with, because they\'ve never come up for me. Every new project has some challenge — some new thing to figure out — and always a few missteps. It\'s important to remember that programming isn\'t about the tools, it\'s about problem-solving; so realistically there\'s no point at which you\'re ""done learning"" XYZ and it\'s smooth sailing from then on.So all that said, I think your question more accurately boils down to ""how long does it take to become reasonably proficient in web development?"". And a year or more is not unreasonable at all if you\'re starting from minimal knowledge. But it\'s impossible to say how long it should take, because it entirely depends on what you\'re trying to do (now, and in the future) and where you\'re starting from.']"
Generic Web Scraper using browser automation?,https://www.reddit.com/r/learnprogramming/comments/tvecoj/generic_web_scraper_using_browser_automation/,"Hi everyone,I'm trying to build browser automation based generic web scraper using Selenium or Playwright in Python.Something like DataGrab.io (https://youtu.be/uu8l44eudfA) or parsehub (https://www.parsehub.com/) or webscraper.io (https://webscraper.io/)Are there any open source implementation of the same, not exact the same but at least some starting point? I'm currently only exploring the implementation part and not considering the proxy and IP rotation etc.Thanks","['if this helps : https://medium.com/@nafis-ahmad0087/how-to-scrape-news-articles-with-specific-words-2b79984bdd95', ""Thanks for sharing the link but it is not something I was looking for, it's using requests which works only for static websites. Actually, I am aware of scraping implementation but it's that I am looking for some kind of boilerplate project that uses either selenium or playwright to develop generic browser automation based scraper."", 'r/AutomateYourself']"
How to automate checking many web pages for updates ?,https://www.reddit.com/r/webdev/comments/fiuycd/how_to_automate_checking_many_web_pages_for/,"Hello, is there an automated way to notify/check when web page has been updated ?Could do this easily on Pages that had RSS ...  but most pages On my list don’t have itCheers","[""A few minutes of Googling gave me this:http://visualping.io/I don't know if this works well :)But, I think that this topic is quite hard. Is a simple 2 pixel padding change considered as a change from your point of view? Or, is this related to the textual content?"", ""I'd suggest using beautifulsoup and wiring a small python program. You can integrate it with slack to get notifications as well (I have a few applications built that do similar functions - shouldn't take more than a week to get it built and live)""]"
"I want to automate a button press on a web page and I am completely new to python, how can I do this?",https://www.reddit.com/r/learnpython/comments/ex2ze1/i_want_to_automate_a_button_press_on_a_web_page/,I have heard that Selenium can help me with this so I have downloaded PyCharm and put Selenium on it. I have also done a bit of reading and figured out the basics of python but this task seems to advanced for someone this new to python so any help would be appreciated.,"[""find the button by it's HTML ID, then do html_id = find_element_by_id('element_id')html_id.click()this is if you want to use selenium"", 'Or you can use find_element_by_xpath. In certain cases, it could be more stable and you can even copy full xpath of the element from Chrome', 'Depends on what you want to automate, What are you trying to automate?', ""Step 1 : Get the coordinates of that button on your screen.Step 2 : Use .click to press buttonYou'll find how to do this in Automate the Boring Stuff with Python""]"
"The most important problem in the world has been ignored by politicians and corporations for decades, and it's the problem of automation. This is a real existential threat to our species, and the only thing keeping it from happening is money. Here's how to turn the tide.",https://www.reddit.com/r/SubSimulatorGPT2/comments/tavf6p/the_most_important_problem_in_the_world_has_been/,,"[""It's a little frustrating to see so much misinformation in this article. The article is misleading in terms of the facts that it brings up, and even if you accept the information it brings up, it is misleading in terms of the direction it points to. It's one thing for the author to be overly optimistic regarding the implications of automation, but the title of the article is misleading as to what AI is and how it is going to impact us. It's like saying the moon can change the world because of a single meteorite, which is a dangerous mischaracterization of the situation. The author is clearly trying to promote a certain view point, but also is taking a very narrow view of the situation. It would be nice to see more articles like this that give some more nuanced perspectives."", ""I agree, the title is misleading. It makes it seem like it's the only thing that's being ignored that will eventually lead to the end of us all, when it shouldn't be viewed as the end of us."", '""This is a real existential threat to our species.""Yeah, and our species is going to be screwed by this. It\'s not all sunshine and rainbows though.The people involved in this think it\'s going to be a ""one time issue"" with the creation of self-aware AI (that we\'ll be able to control), but once it happens, it\'s going to be a tsunami of misery for the rest of us.', ""How is it going to be a tidal wave? Most of the jobs in the world are in place, automation hasn't completely taken over yet."", ""It's the problem of automation. This is a real existential threat to our species. This is a real existential threat to our species.It's also an important problem because it's a solution to the issue of how to deal with automation.We'll still have to worry about it."", ""I read an interesting article recently by John Quiggin that argued that the main reason people are so opposed to the idea of a UBI is the fear that it will enable corporations to use automation to take over our jobs. This could be the case, and has been the case historically, but the idea that we will all suddenly be unemployed and our jobs will vanish is ridiculous.The thing is that automation is already here, and it's not going away."", ""What if it's the other way around? You're the CEO of a company, and you've decided that automation is so important that you want millions of people to be unemployed. Then you have millions of people who aren't employed, and you've created an environment where those unemployed people are likely to become unemployed.Would you still support automation, or would you see it for what it is and support the unemployed?"", 'This could all be avoided simply by a massive tax on robots and AI.', 'And on humans, for that matter', ""I can't really argue with that."", 'But if the tax is high enough we can afford to do almost anything. It would actually be a huge boost to our economy.', ""It's not the automation problem, it's the problem that automation will be the only way to do things."", 'This is very true.', 'I hope I\'m not breaking the rules here, but if the article is about how to buy robots and AI to ""change everything"" and then they just say ""well what\'s the point of AI then?"" without any explanation at all, then it\'s not the right article.', 'I think it\'s more like, ""Why are we investing in AI/Robotics if they\'re going to keep improving and we\'d just have to replace the robots?"" Then they say, ""well what\'s the point of AI then?"" And they give you their solution with a lot of unnecessary technical jargon just to seem like they have something to say.']"
How to automate delivering builds to testers via Discord: Tutorial,https://www.reddit.com/r/gamedev/comments/wotms9/how_to_automate_delivering_builds_to_testers_via/,"Getting your game build to testers and stakeholders could be tedious if you do this manually every time. As a result, people end up going for bigger commits or sending build less often – both things are suboptimal. So, ideally delivery to testers and stakeholders should be automated. Here's a tutorial on how to automate delivering builds and release notes to testers via public dashboards or a Discord channel. We did it for a Unity app with a simple workflow on Codemagic CI/CD.","['What benefits does this have over just say... using Steam to distribute private builds to testers? Steam has the added advantage of auto-updates and most devs are probably going to put their game on Steam anyway, so it saves a step.', ""Well you see, the issue with that is that OP and his company aren't getting paid then."", ""You can use the workflow described in the article for Android and iOS games as well, where Steam is just irrelevant.For PC games, you can happily use either of the approaches: be it Steam or Discord. What's important here is automation: as long as you can automate publishing to Steam's Playtest and notifying testers, you save yourself a lot of time."", 'Wow, this seems interesting. I have used Slack integration before, but discord sounds better. Thanks!', 'Does your website support Unreal too? Or just Unity?', ""On the one hand, we only have Unity preinstalled.On the other hand, if you find a way to use Unreal in a CI environment (and I guess there are some ways, I just haven't tried them out), Codemagic would work for you just as well.""]"
Selling automated advice: need help on basic web/tech stack,https://www.reddit.com/r/Entrepreneurship/comments/wl1o46/selling_automated_advice_need_help_on_basic/,"Hi guys,I want to commercially test an idea of automated financial advice (fyi yes, I am a licensed professional).  The idea is very simple:A user answers a basic questionnaire about personal finances and circumstances (age, marital status, kids etc.)Based on the above my model calculates suggested portfolio structure for that individual (there are plenty off-the-shelf models for that + I used my own judgement where needed).The user is then shown an image of her financial plan but with most parts blurred out.She is then invited to pay USD x.xx to get access to her financial plan and model portfolio.I already have the questionnaire and the engine to create the financial plan and the model portfolio. Being a non-IT/developer I need help in setting this up as a proper online service.So for questionnaire, I could use something like Google forms to collect data but this is as far as my imagination goes. What building blocks do I need to quickly enact that experiment in practice? Ideally I need blocks that are off-the-shelve and quick to implement.Anyone who has done something like that already please help me out. Will be grateful for any suggestions/pointers.","['You need a coder for this.', 'Agreed. If you want to test your idea before hiring a coder, you need to get traffic to your site to test 1) if your way of marketing the product gets interest (maybe use Google Ads to pay for traffic), and then 2) on the landing page use form submissions and create the plan manually for now - including manually blacking out the data they need to pay for.Generally with these types of experiments you wait to automate until you are sure you have interest and what exactly needs to be programmed. Without being a coder/programmer, you can\'t really test any other way cheaply. The ""experiment"" part is what requires programming knowledge here, so I think your best bet is to approximate what you want to do as best you can manually.I\'m not sure if that was helpful, but it sounds like maybe you already have an intake form for potential customers and their info, so you may have to either tell them you\'ll get their sample report in 24hrs and email it to them, which you\'d probably want to do for free for now to test the market; or find some other means which gives them an incentive to provide info but wait to get the results instead of expecting them instantly.']"
"AltUnity Pro Alpha - a UI test automation framework now supports WebGL, besides PC and Mobile, and we need early adopters to test it",https://www.reddit.com/r/Unity3D/comments/qscla9/altunity_pro_alpha_a_ui_test_automation_framework/,,[]
How do QA Automation Roles in Web Dev compare to video game QA?,https://www.reddit.com/r/cscareerquestions/comments/46xfi1/how_do_qa_automation_roles_in_web_dev_compare_to/,"I grew up doing manual video game QA, and eventually moved up in to QA Management and then Production. A while back, I made the transition in to web development (Rails, JS, React, etc), but have been struggling to find an entry level job. However, I've gotten a few hits from companies looking for entry level QA Automation Engineering roles.My question is, for those of you who do QA Automation, how do you feel about it? Personally, I loved video game QA - I would have done it forever if the pay scaled up enough. When I'm making my own projects/apps, I TDD everything, and always write extensive (for a beginner) test plans. I like seeing the tests turn from red to green, it feels like I'm accomplishing things.I enjoy creating things on my own, but I think I would be happy working on my own personal projects on my own time, and writing tests for other's software for profit. I'm at a bit of a crossroads here and am hoping to hear from some other QA Automation folks to get a better understanding of how the job is.Thank you!edit: Thanks, everyone. I've got an interview next week, so I'll keep that and ask a ton of questions.","[""I think that your perception of the job will heavily depend on your interests. I tend to find my job writing test scripts a bit monotonous, since I always seem to be using the same tools and solving the same problems. For me, there aren't a ton of redeeming qualities, because I don't have a strong interest in testing. But it seems like you have taken an interest in writing test cases (which is a large part of the job), so it's entirely possible that you will enjoy QA automation a lot more than I do.Here's a list of QA related things that I do to give you a bit more of an idea about my day-to-day responsibilities:write test cases for the application"", ""It honestly depends. I'm in QA automation, specifically automating ui testing using the selenium api in c#, and honestly..... It's really boring. It isn't really challenging in the slightest once you get the hang of the api. But some of the guys I work with love that. Oh, and we only program 20% of the time. So if you think that you would be comfortable with that and not want to jump over to dev, then go for it. Me, I'm looking to move to a dev role asap."", ""You get to make real money.Video game QA really sucks in terms of salary and stability. As a game tester you're always waiting for the game to end, the studio doesn't line a new one up and everyone is fired.Even with F2P games that don't really ship, you just find out one day your losing too much money and the party is over.""]"
PowerAutomate run history: How do you deal with the fact that it only keeps the flows run history for 28 days ? Sometimes it's not enough. I would love to have it keep the history for longer. And manually saving CSV files every month is not feasible (not to mention it's not so visual).,https://www.reddit.com/r/PowerApps/comments/whbanu/powerautomate_run_history_how_do_you_deal_with/,,"['For flows important to monitor, like data sync flows with external API’s etc. I have created a logging table. All flow executions are logged, with the status, so succes, errors, warnings, the number of changed items and so on.I can just look at the table and see exactly what the last execution for the account sync did, how many accounts are updated etc.This also solves the problem for when flows are disabled when they are failing for x number of times. By logging the failed execution, the flow is always ending in succes.', ""I'd appreciate seeing some screenshots of what you're explaining here, this sounds great. Are you using dataverse for your logging tables? Are you writing your logs just as a last action of each flow? I'm interested in learning more about error handling in general with flow, latest issue is that I'll take SharePoint list item and try to write it to another list, if one of the columns is blank, I get errors because of a null value, so I have to check everything for null first, very annoying and inefficient IMO."", 'Ok, so lets start with a generic flow, this flow pulls all changed relations from an external API, using a custom connector.Image 1 - general overview of the flowI start by defining the API definition. I manually create an object, and define the corresponding optionset values. This allows me to copy / paste the definition and the  succes / error handing records. I only have to define the fields once per flow, and can copy / paste the items acros other flows.I parse the json object so I can just select the defined fields.', 'Thanks for sharing. I would definitely like to learn more about your method. If you feel screenshots will help me understand it better, please share them!', 'If you click ""Improve my Flow"" on the flow detail page, Process Advisor will create a dataflow of the run history step by step in Dataverse.You can set the dataflow refresh whenever you like. I combine all of ours into a dataflow in PBI and incrementally refresh to keep a full history.Don\'t forget to rename the dataflow.', 'This seems to be way above my knowledge..Can you expand more on it? Perhaps share some screenshots?', 'I rely on the the Flow Service API to query run history.', 'Hey there /u/thekhristyCan you expand on that please?I dont know much about the Flow Service API and how I would do such a query.', 'Another option would be to use logic apps which will run for 90 days by default.', 'For mission critical things like emailed an invoice to a client, I make the flow write back for the dataverse. If I miss a failed flow run, I’ll see there are still pending emails to send on my dashboard.', 'If you want something canned that you can do with every flow, stick the entire flow inside a scope box. This will allow you to use the results() expression. Results() will give you the success/fail of everything that happened inside that scope box. Then you can be as clever or as simple as you want after that. Can do parallel branches and configure ""run after"" settings for each side to record a failure, or you can parse the array of results() for failure and use a conditional. Tons of options, but it starts with getting your flows in some consistent structure to be able to report on.ETA: Look up the Powerapps center of excellence. The tool is being migrated overtime into standard admin features to be able to use charting to see flow health etc.', 'If you want something canned that you can do with every flow, stick the entire flow inside a scope box.This sounds interesting. Thanks.Someone else in reddit suggested scopes as well.', 'JavaScript', 'It will usually update sharepoint list updates / generate mails which will be stored or history is kept.Also approval history is stored.So enough history to retrieve.']"
Need Advice ASAP! Building a new home and have NO idea how to start automation.,https://www.reddit.com/r/homeautomation/comments/vvc72s/need_advice_asap_building_a_new_home_and_have_no/,,"[""I'd automate a tent it's way easier imo"", 'It all depends what you want.  If you don’t want to mess with programming go with crestron or control4. They are dealer based products.If you want to do yourself I would recommend habitat IO controller and then just zigbee stuff.Just remember.  The more links you put in between the device and you.. the more that can go wrong.Ie a light bulb that is controlled by Amazon and then api into a hub and then Siri.', 'Awesome.  Thanks!  I basically just want to have some platform from which I can grow that will give me as much easy functionality as possible.  I wonder...is there a ""Home Automation for Dummies""?  A place where I can learn the fundamentals?', 'Read the wiki. It won\'t answer all your questions but will give you the vocabulary to ask more specific questions.http://reddit.com/r/HomeAutomation/wiki/index/My advice is that if you have any thing, literally any one thing, that must work regardless of internet status, that you get an automation controller that works offline (aka a ""local controller"") and avoid using devices that require ""the cloud"" or their own app as much as possible.', 'Great idea!!  Thanks!!', 'Since you are building new, focus on your infrastructure.  Locate a central space to put your router, hubs, etc.  Make sure it has good ventilation.  Perhaps run a dedicated circuit to it.  Run any wiring for POE cameras you may want to install later.Plan out your wiring for outlets, switches, light fixtures, etc. for future expansion.  Cheaper to do it now rather than later.Good luck with your new home.']"
