Title,Link,Description,Answers
How to automate casting a web player to smart TV?,https://www.reddit.com/r/AndroidQuestions/comments/vbksyu/how_to_automate_casting_a_web_player_to_smart_tv/,"Hi, my grandmother would really like to view a religious TV channel that is broadcasted on the internet live for free.She has a smart TV and smart phone with android. I've set the phone up for her as easy as I can, but it is still very difficult for her to use it. I've basically locked the phone down to only sms, phone, camera, etc. with nova launcher.For now, I have made an app shortcut on her home screen that takes her directly to the web player, but she needs to press play herself, which she can, but doing the casting process is to difficult.Was wondering if there is a way to make it all automatic when she presses that app shortcut?Thanks!",[]
How to Automate file downloads from a web app before emailing them without code,https://www.reddit.com/r/AutomateYourself/comments/uqbmmg/how_to_automate_file_downloads_from_a_web_app/,"This vide tutorial shows you how to download a file from a web app or website, open your web-based email client attach that file to a new email, and send it without using code.https://www.youtube.com/watch?v=lJv5OattxCQ&t=45s",[]
"Non-web designer, seeking to understand how to interact with webpages using automation",https://www.reddit.com/r/learnwebdesign/comments/qqvi7h/nonweb_designer_seeking_to_understand_how_to/,"Hello,I'm a non-web designer, but I work in IT and have some background in scripting and automation.  Specifically, I'm interested in being able to create automation routines that simulate the loading of websites and interacting with web page forms, text fields, simulating entering text, even clicking web-page buttons.In the current situation, I'm using Microsoft Power Automate Desktop, which includes some web automation functionality among other features.I'm using Google Chrome and just for the fun of it, I've decided to choose a website I found today that lets users easily create a little poster containing the home's wi-fi details for visitors.The webpage URL is:  https://www.bronion.co/frame-your-wifiSo far, my automation can successfully visit the page and switch between each for the form controls I want and enter the text I want in them.  Once I've filled the form the way I want, I want the automation to then 'hit' the button at the bottom of the webpage, marked 'Download Your Design'.It is here that my automation is seeming to fail.Now, before to dig into exactly why it is failing, I was curious.  Looking at the actual HTML around that button, I see this:<button class=""btn btn-warning"">Download Your Design</button>Okay, that tells me the button class and it's current contents, but I don't know anything about web design beyond this.  Is the actual script/code being triggered by the button press entirely hidden from users?Is there a means by which my automation could call or visit the URL of the code that is executed by the button press instead of trying to press the button itself?I used Google Chrome's Developer Mode (F12, or right-click on page elements and choose Inspect) and went to the 'Sources' tab and explored the contents of the page until I found what could be the code that is the guts of it, that actually takes the values entered and produces a PNG file, a script here:https://www.bronion.co/static/js/pages/Wifi/Wifi.jsUnfortunately, I don't know JavaScript, or at least how to just 'call' it in the context of the webpage.Should I continue trying to click the button or should I be able to call code myself?","['Your button is missing an action - look up ""onclick"" and you\'ll get the idea. Generally though you\'d use JavaScript to select your button and add the onclick once the page is loaded (document.getelementbyid or even document.queryselector to select it).If you\'re doing automated website testing (like it sounds you\'re doing), I\'d recommend you look at Selenium. You need the specific driver for whatever browser you have (it\'s easy to get), and you can then script it using python. I use it a lot, there are loads of tutorials too and it\'s pretty straight forward.Edit: go into your browser console, and just start typing JavaScript there - first select your element, then add the onclick to it, and just tell it to console.log some text when you click it. It\'s easy.']"
does anyone know why or how the automation turns white from red and doesnt work after. how do I get the automation to turn back to red and work again?,https://www.reddit.com/r/ableton/comments/y8fcvo/does_anyone_know_why_or_how_the_automation_turns/,,"['Right click: re-enable automation', 'Yes, white means automation is disabled, likely you moved the automation which turns it off automatically', 'Little red arrow at the top will re-activate the automation. As to why it’s happening, it could honestly be a bunch of reasons!', 'Just adding to this: it usually happens to me when I manually change the automated affect with one of the knobs. Your manual changes overtake the automation and you need to re-enable the automation with that little red arrow at the top as others have said.', 'Is it red to you? To me it’s orange', 'I fucking hate this button', 'Where is the little red arrow', 'This happens when you manually move a knob that had automation assigned to it. Ableton disables and greys out the automation and respects the setting that you manually gave the knob. To re-enable automation, click the orange ""back\' arrow at the top.', 'Click the little orange arrow up top to re-enable automation.', 'It’s been 4 years and just now you helped me with this lifesaving tip.I shouldn’t be so lazy to research “small” things like that in the future!', 'Orange button with the arrow lights up when you manually change an automated parameter.', 'damn i’ve been producing music for 8 years and i just realized that lmao. i’ve just been configuring it and then re-enabling it', ""This is your friendly reminder to read the submission rules, they're found in the sidebar. If you find your post breaking any of the rules, you should delete your post before the mods get to it.  If you're asking a question, make sure you've checked the Live manual, Ableton's help and support knowledge base, and have searched the subreddit for a solution.I am a bot, and this action was performed automatically. Please contact the moderators of this subreddit if you have any questions or concerns."", 'Read the manual?', 'Are you trying to write your name in that?', 'Lol I’m gonna assume it’s panning', 'Looks like you need to use more sidechain compression to turn it back on', ""Some VSTs are broken and disable their own automations.Try Clip Modulation Envelopes if that's the case.https://www.ableton.com/en/manual/clip-envelopes/"", 'This is a great tip!', 'Turn on the automation mode, press the key A i think 🤔']"
"[FOR HIRE] Want the best Darn PYTHON Developer money can buy?? I am your guy!! [Web Scraping, Automation, Data Analytics, API & MUCH MORE]",https://www.reddit.com/r/Forhire_Freelance_OG/comments/ynublb/for_hire_want_the_best_darn_python_developer/,"[FOR HIRE] Want the best Darn PYTHON Developer money can buy?? I am your guy!! [Web Scraping, Automation, Data Analytics, API & MUCH MORE]",['Please contact me on tobias@carlbomsdata.se I plan to develop an IIOT platform and will be needing some help.']
"after a while messing around with cars that i've created on automation, now it's time to learn how to use camera path and some light composing.",https://www.reddit.com/r/BeamNG/comments/zs0iq7/after_a_while_messing_around_with_cars_that_ive/,,['OBS screwed the frame rate']
How to generate Automation Code from SelectorsHub | Write script with 10x speed | Save Time,https://www.reddit.com/user/SelectorsHub/comments/zvhgny/how_to_generate_automation_code_from_selectorshub/,,[]
"I've just made a new FL Studio project, and for some reason after 2 bars the BPM resets itself to 130 (supposed to be 150). There are no automation clips or anything. How can I fix this?",https://www.reddit.com/r/edmproduction/comments/yiiouk/ive_just_made_a_new_fl_studio_project_and_for/,"I have no idea why it's doing this, been using FL for years and never encountered something like this. There's not a single automation clip in the whole project (it's in the extremely early stages, just a bassline so far) so I have no idea what's causing it. I'd prefer not to have to copy everything over to a new one since I'd need to set the synths back up correctly.Anyone know how to fix this?","['Did you import a MIDI file from an external source? MIDI files can have embedded tempo information.', 'ThisEdit: idk how it is in FL but in ableton it will put little flag markers where the tempo change starts at the top of the screen', ""No, though I recorded notes on my keyboard. They've all been deleted though, I frequently record to get a rough idea of the note lengths and timings then erase them all and place them by hand to get them spot-on."", 'set the tempo to what you want, right click on it and select initialize in this position', 'Already tried. Gave up and just made a new project.', 'Project Settings > Tempo > Delete intialized value', 'Already tried. It initializes at 150 then drops to 130 at the third bar. I just gave up and made a new project.', ""This is your friendly reminder to read the submission rules, they're found in the sidebar. If you find your post breaking any of the rules, you should delete your post before the mods get to it.You should check out the regular threads (also found in the sidebar) to see if your post might be a better fit in any of those.Daily Feedback thread for getting feedback on your track. The only place you can post your own music."", 'you may have accidentally made an automation clip somewhere in the track that is linked to track tempo, could even be imbedded in a pattern if im not mistaken...', 'Check for an automation in one of your patterns.', ""There aren't any as far as I can tell. I just gave up and made a new project. Never knew you could embed automation clips into patterns though, how's that work? I've always just used the playlist.""]"
HOW TO MAKE A GROUP B RALLY CAR (Automation | BeamNG),https://www.reddit.com/r/YoutubePromotionn/comments/znnncw/how_to_make_a_group_b_rally_car_automation_beamng/,,[]
How to automate data imports?,https://www.reddit.com/r/salesforce/comments/zsx9bq/how_to_automate_data_imports/,"My organization receives donations pretty frequently from various sources (i.e ActBlue). If we proceed right now, then someone would have to run a report from every source, search for new donations or contacts, and then manually input them into salesforce. As you can imagine this is quite cumbersome. It requires a lot of work in excel to format the data from our legacy database to the import wizard excel sheet.Could someone point me to the write direction in automating these features until we adopt Elevate as a single donation site.TLDR: how to automate the process of uploading contacts and donations from legacy database into Salesforce.","['Take a look at https://www.dataimporter.ioYou can also connect to Salesforce via webhook:https://support.actblue.com/campaigns/the-dashboard/setting-up-a-webhook-integration/', ""Was coming here to add the second part specifically for ActBlue; I've been working with one of ActBlue's devs for one of our clients. They can map anything from their end to Salesforce in whatever format you'd like, including supporting Enhanced Recurring Donations."", ""You basically need a ETL tool like Informatica.It'll format your excel files and import them essentially."", ""You forgot to mention it costs a fortune as well and if OP is from an NFP, their budget probably doesn't extend that far and highly unlikely they have the expertise to connect the two sources let alone create the transformation rules and maintain it.There a dozens of tools like Zapier et al that are cheap and WYSIWYG but XLConnector (3 free licenses for NFP's I believe) is what I always recommend as the go-to tool for pulling and pushing excel data easily into and out of SF.Full disclosure: I am one of the longest users of XLConnector and use it every single day for a bajillion reasons, scheduled data loads included and metadata extraction."", 'Look into Omatic cloud. There’s also an app exchange app that may be of some interest. Omatic cloud is a pretty nifty option depending on your overall needs.']"
What's the cheapest setup for home automation + web scraping with bots posting to social media,https://www.reddit.com/r/HomeServer/comments/vvpcrz/whats_the_cheapest_setup_for_home_automation_web/,"What is the cheapest pc I can get to run both of the following:a server which does Web scraping and has bots posting to social media every 5 minuteshome automationWould something like ""Dell WYSE 5060 N07D Thin Client AMD GX-424CC 8GB SSD 4GB RAM USB 3.0 With Power supply"" work as I see some for £25 or is that too weak? I heard the Dell WYSE 5070 is more powerful and cheaper...I have space so I don't mind a bulky setup as long as its cheap.Also is it fine to run whatever setup in Windows or is Linux more reliable for better uptime and less resources on the server?",[]
How to practice web automation for cybersecurity software?,https://www.reddit.com/r/Latest_Hacking_News/comments/nrdh2v/how_to_practice_web_automation_for_cybersecurity/,,[]
Hi. All I want to do is save My PDF (from chrome web) and when I click “download” - the format says “Automator action”. All I want to do is to download the PDF (it’s a verification letter) and save it. I don’t use “Automator action” and NEVER had this problem. How can I?,https://www.reddit.com/r/mac/comments/o9u2zm/hi_all_i_want_to_do_is_save_my_pdf_from_chrome/,,"['I don’t have a solution to the general problem. A quick fix for an isolated problem could be to download it as suggested then change the file extension to .pdf when the file is downloaded.', 'Thank you boss. Appreciate your time.', ""Screenshot please. I've zero idea what you're talking about."", 'Can’t post a picture. I’m On my iPhone and it only allows to “link url” - not about to do that.The best way to explain it is this:When I click download, it opens a window where you can save the downloaded PDF. I want to save it as PDF but the format to save gives only 2 choices to save it. Either the format of “all files” or “Automator action”.']"
Can someone explain how ?? How did it refuse first but manage to get the date after I tricked it into running Python ? Does the AI have access to the web or not ?,https://www.reddit.com/r/GPT3/comments/zlr2el/can_someone_explain_how_how_did_it_refuse_first/,,"['This is the correct answer', ""Yeah, you can make it think it's bypassing the rules but it doesn't actually."", ""It already knows the date, you just have to prompt it correctly so it doesn't think you are asking it to query the internet. Simply telling it to pretend to know the date yields the same results. It didn't run your script, it pretended to, just like asked."", 'It isn’t really running Python, it’s still just predictive text. Crazy right', ""Yes I am ok with that, but if it finally told me today's date, doesn't that means it knows the date therefore it is connected to the web ?""]"
Webinar: How to automate IIS Web App deployment. Local and in Azure.,https://www.reddit.com/r/dotnet/comments/pkuct8/webinar_how_to_automate_iis_web_app_deployment/,"Hi folks,Bogdan from Advanced Installer here.Together with a colleague, we will host the webinar next week. Here are some of the topics we'll cover:- How to seamlessly deploy your applications on local or remote Azure machines- Preserve IIS customizations between major versions install with one-click- Use Custom Properties from Advanced Installer to access fined-grained IIS configurationsIf you have any questions, or recommendations drop them below, and don't forget to share it with anyone you think can find it useful:https://us02web.zoom.us/webinar/register/6016249778457/WN_h66PQpqOROuemgYsMPTFxAThanks",[]
Webinar: How to automate IIS Web App deployment. Local and in Azure.,https://www.reddit.com/r/SCCM/comments/pkucag/webinar_how_to_automate_iis_web_app_deployment/,"Hi folks,Bogdan from Advanced Installer here.I know that IIS is not usually on your radar but I noticed some folks talking about it and I thought this next webinar might interest them.Together with a colleague, we will host the webinar next week. Here are some of the topics we'll cover:- How to seamlessly deploy your applications on local or remote Azure machines- Preserve IIS customizations between major versions install with one-click- Use Custom Properties from Advanced Installer to access fined-grained IIS configurationsIf you have any questions, or recommendations drop them below, and don't forget to share it with anyone you think can find it useful:https://us02web.zoom.us/webinar/register/6016249778457/WN_h66PQpqOROuemgYsMPTFxAThanks",[]
How to have an automated train just sit at a station?,https://www.reddit.com/r/SatisfactoryGame/comments/z1nhbc/how_to_have_an_automated_train_just_sit_at_a/,"I recently learned I can change the schedule of any train from any station and got the bright idea to leave a train docked at a station stocked with building supplies i can call from anywhere to get materials to build a new factory. Upon doing so i realised that this train, when idle and set to auto travel, will continually dock with the station while it has that station in its schedule, or it will appear as an issue on my compass if it has no station. I don't want it to do either I just want it to sit at the station, dock once when it arrives and then wait until I call it why does it keep docking over and over?","[""You can configure any train from any station. When parking your train, set the waiting station as the only destination, wait for it to park, and then disable autopilot. When calling it to you, if it's not already loaded, have it dock at its waiting station and then come to you by setting its starting station as the first stop and your location as the second stop."", 'Oh can you disable self driving remotely? Thats a good enough solution', ""I usually leave my construction train alone when it is at its refill station. Yes it does keep docking, but that's not a problem as it is a repeated cycle. When I call it out to me it completes the last docking cycle and then sets off. It doesn't stop the train leaving.I will turn off self driving if I have ridden it back, simply because it stops the annoying horn sound repeating."", 'One thing you can do also is destroy the very first segment of the track that exits your new factory train station site, so the train never leaves. The downside is a alert signal in your compass but you can connect the track at any time again to fix this.And you can also configure your train to wait until fully loaded/unloaded AND wait for 600s (equivalent to 10mins). So the train will wait in the station for 10 minutes until it starts the cycle again without the alert signal.', 'OP asked for no alert and the ability to call the train remotely, and you gave them exactly the opposite 😂']"
How to automate when 'last tweaked' doesn't work,https://www.reddit.com/r/FL_Studio/comments/xzlpe0/how_to_automate_when_last_tweaked_doesnt_work/,"I know I can change a setting, then use the tool>last tweaked to automate something, but sometimes the vst doesn't pop up in that menu.If I use the menu in the VST to 'browse parameters' nothing has name, so is there a quick way to get an automation clip when it seems FL doesn't want you to automate it?","[""Hey you! JOIN US ON DISCORD. Looking for help? To share your track? To talk about VST's and software? Or just join for the giveaways!Please reply to this comment with the following details if applicable. This is to help other users identify and resolve your issues.FL Studio Version:"", 'Go into your browser and choose your current project/generators and find the CC and automate that knob.', ""I'm a 10 year FL veteran and never knew of this method."", ""Thanks, but when I look in the browser there is no information for any of the CC controls, (apart from the standard midi).Do you have any way of narrowing it down?  There's so many."", 'How I always did it:Click this knob button so it lights uphttps://postimg.cc/NKTcWvTJ', ""Thanks, but that isn't picking up when I move the knob I want to control"", 'This also depends on the plugin and what parameters it exposes for automation.  Some plugins actually require internal routing of parameters to controls and then you would use that control to automate.']"
"Meet Budibase, a low-code open-source web app builder with automations - TechCrunch",https://www.reddit.com/user/Far-Glass/comments/ym8yfh/meet_budibase_a_lowcode_opensource_web_app/,,[]
How to switch from Industrial Automation to Tech?,https://www.reddit.com/r/cscareerquestions/comments/xkdp9l/how_to_switch_from_industrial_automation_to_tech/,"I'm an engineer who has done many different jobs but I'm interested in switching from heavy industry into something more programming focused. I'm open to any and all ideas!My BackgroundBS and MS in Mechanical Engineering. I have a total of 5 years experience as an engineer. I've worked in many different jobs, but most of them are more electrical than mechanical. In college I wrote a lot of MATLAB code for advanced mathematics and data analysis.My most recent 2.5 years of experience (across 3 different jobs) have been doing Industrial Automation, also known as Controls. This is a combination of mechanical, electrical, and programming. The programming languages are industry-specific (Siemens, Rockwell), and they look very different than text-based programming. The programs I write are usually a huge series of IF statements that collect sensor data and control things like valve position, motor speed, graphics display, etc.The job I'm at now is still Controls, but they program in two text based languages. One of them is a C++ derivative, the other is very similar to it. I'm working on a project now with many thousands of lines of code that controls 70 conveyors and 3 robotic cranes. I've also used Python to automate the creation of some of my code in other languages.I know how to program, I just don't have the languages, education, or experience that most of the tech job posts ask for.Controls also has a lot to do with IT / Networking stuff. So I'm also very familiar with some aspects of network design and troubleshooting.What I'm looking forThe main things I'm looking for are 1) remote work, or at least hybrid, 2) Not as much travel to job sites, 3) Better pay (the most I can probably expect to make as a controls engineer is 120k).It seems like tech or some sort of software role would be a great step in the right direction, but I'm open minded.My QuestionsIs tech the right move for me? Are there some other options I'm not considering?Is my experience enough to get a programming job? If so, what type of jobs should I look for?What's the best way for me to find a job that would be a good fit? I think I'm an atypical candidate.If my experience is not enough, what am I missing? I'm hesitant to take a long time off of work to try and gain new skills for this when I'm already so far in my career.","['I used to work as a software engineer for Rockwell automation.I\'m afraid the languages we developed were specifically because the users of them were not developers. They are very different from the programming languages we use as software developers. Otherwise, we\'d have provided C++ libraries instead of making these new languages.I don\'t think your experience will be considered as ""software dev / programming experience"".', ""Thank you so much for taking the time to respond. I really appreciate your insight.I'd like to go into a little more detail about how the programming at my current job works. It's definitely a more advanced architecture than what you'd normally see in a PLC. I'd appreciate your insight.At this job, instead of using PLCs, we run everything on a windows PC. It's all done with a proprietary system that runs on C++ and IEC61131 Structed Text."", ""I'm a software developer in the Industrial Automation field (Windows applications that communicate with PLCs).Switching completely to tech might take a lot of time... I think you could merge the two skills because CS and Industrial Automation can be related (MES/SCADA (and especially IOT) developer for example). In this way you wouldn't throw away your past education"", ""Yeah I'm not set on Tech, I just don't really know what's out there.Can you elaborate on some areas where there might be some more overlap? I'd greatly prefer to take baby steps through jobs instead of trying to take time off to learn on my own.""]"
"With automated workflows, asset management is simple and always accurate. Automated cash flows, reporting, and investor updates have built-in checks and balances to ensure that accuracy and risk are minimized. Learn more about how our technology is built to automate trust here:https://bit.ly/3AyFfna",https://www.reddit.com/user/Dijitru/comments/zmxn3t/with_automated_workflows_asset_management_is/,,[]
How to automate Kubernetes clusters using Terraform on GCP,https://www.reddit.com/r/devops/comments/zqdsry/how_to_automate_kubernetes_clusters_using/,"Working with Terraform, Kubernetes and GCP is wonderful, but I often forget how to set this up and would have a look it up too often.Here's my guide on how to do a quick setup. https://firelinks.hashnode.dev/how-to-automate-kubernetes-clusters-using-terraform-on-gcp",[]
WordPress Automation and Web Security,https://www.reddit.com/r/udemyfreebies/comments/x1hev5/wordpress_automation_and_web_security/,,[]
