Title,Link,Description,Answers
"Self taught front-end developer, about to meet a recruiter for a mobile dev position, how transferable are web dev skills to Mobile dev?",https://www.reddit.com/r/learnjavascript/comments/xljzvi/self_taught_frontend_developer_about_to_meet_a/,"I really haven’t done any research into mobile, just been learning general front-end/react skills. Should I be worried about missing extremely important concepts/questions about specific to mobile development?","['Really depends on what mobile stack they are using. Your React/web knowledge will help your understanding React Native but not really something like Swift or native development', 'What about flutter?', 'I was react only and got a job with react native with no experience. It is very similar. Biggest change is routing pages vs the react native stack.You will be ok, but you said you haven’t done any research yet, I would read up on it prior to show you are enthusiastic to learn.', 'i just completed a fullstack js bootcamp 6 weeks ago and just got an offer for a jr mobile developer role (react native/java) so it’s definitely doable', ""hot damn good for you. I've been struggling to get interviews and I completed a bootcamp almost 3 months ago."", 'what boot camp if i may ask?', 'It’s doable with react native as there is lots of crossover, but there are also significant skill gaps you will have to work hard to overcome. Basically anything not related specifically to react and mobile specific will be new to you. The developer tools are involved and will require allot to learn. The pitfalls are very different. You will need to learn a bit about iOS like Xcode, complex build settings, c# or swift, and android, android studio, Java. Many JavaScript libraries are based on there being a browser which there isn’t in react native so you will need to work specifically with react native libraries in most situations. Test phones, release vs debug builds. Signing keys. The lay of the land with the Apple Store and Google play store. How and what to test. Navigation libraries vs routes. The app itself is built with hooks, state, and components along with whatever database you are used to using… despite all those likely gaps much of your work will be doing reacty things so as daunting as that list sounds it’s doable if you work hard.', ""You mean mobile web, or native? They're very transferrable to mobile web, not at all transferrable to native."", 'It’s a react-native position and I do have decent knowledge and practical projects in React', 'Yes, I did this exact career change a few years ago! If you have proven experience as an engineer (or a good portfolio of work), it’s less about the tech stack and more about the fact that you can solve problems and learn new things quickly. Also, React Native is pretty similar to React.', ""you'll adapt fine. Just pay attention to mobile conventions and displays, don't forget mobile screen sizes and always consider that mobile dev is for users who use their finger, not a mouse. My first programming job was in a startup where I mostly had to do every aspect of ux/ui and front-end including mobile dev and I learned so much, it's fun! Good luck"", 'This depends... \xa0You can technically make an app using web tech, but typically companies just hire web devs for the job. Then maybe a person to configure the wrapper which is basically a Java app that opens a stripped browser window. \xa0You also have react native, so any react experience will transfer over to that. \xa0', 'React native: very transferable. Similar to react in almost every way. Still has a learning curve.kotlin, w/e tf ios uses, java... flutter/dart, all those are completely different.', 'The value you being is not knowing how to code in react. It’s to solve problems. The language is just a tool.  It’s way easier learning a second language than the first. You’ll be fine 💪']"
"I want to automate a button press on a web page and I am completely new to python, how can I do this?",https://www.reddit.com/r/learnpython/comments/ex2ze1/i_want_to_automate_a_button_press_on_a_web_page/,I have heard that Selenium can help me with this so I have downloaded PyCharm and put Selenium on it. I have also done a bit of reading and figured out the basics of python but this task seems to advanced for someone this new to python so any help would be appreciated.,"[""find the button by it's HTML ID, then do html_id = find_element_by_id('element_id')html_id.click()this is if you want to use selenium"", 'Or you can use find_element_by_xpath. In certain cases, it could be more stable and you can even copy full xpath of the element from Chrome', 'Depends on what you want to automate, What are you trying to automate?', ""Step 1 : Get the coordinates of that button on your screen.Step 2 : Use .click to press buttonYou'll find how to do this in Automate the Boring Stuff with Python""]"
How do people automate web tasks?,https://www.reddit.com/r/webdev/comments/o775mh/how_do_people_automate_web_tasks/,How do I automate web tasks?If there happens to be a website. How can I automate tasks? How do I check for responses? Is there a tool to do this?,"['Question too vague to answer with anything more than “programming”', 'If people have developed web site, how do they test they work? Do they use manual process? I am happy to re-use that tool for my purpose.', 'Sounds like OP is looking to scrape data', 'I want to do both. I want to automate certain web tasks, but I also want some form of confirmation, that it is correct, just in case something went wrong....']"
How to do fully automated defending with the new update?,https://www.reddit.com/r/eFootball/comments/xqlidd/how_to_do_fully_automated_defending_with_the_new/,"I really hate the new defense buff. I was able to manually defend quite well with the prev versions. Normally I'd just pressure, try to anticipate the pass, and keep switching players/ calling another def to block their paths, but their (other online players) defense works a lot better now. With the most recent updates, any player can just bump into me and steal my ball easily, WITHOUT ANY FOUL.Looks like there's nothing I can do except going with the flow. So how can I defend like them? In other words, what do they do? Just holding tackle (like the old X button)? I heard about shoulder charges but never used it before. If it's shoulder charging, how do I do it? Just should charge every time I get near an opponent?","['Lmao thisEveryone just R1 and then spams shoulder charges', ""Lol. That's hilarious. Thanks dude. I'll try it."", ""This game is like a survival horror game. All game I'm dodging and weaving shoulder charges. Even when I escape cleanly, one shoulder charge to my back ruins almost all of my attacks. It's insanely powerful."", ""You've never actually used shoulder charge have you?"", ""Normally I'd just pressure, try to anticipate the pass, and keep switching players/ calling another def to block their pathsI still think that is the best, most enjoyable, way to defend - and you can make it work just keep at it.""]"
"AltUnity Pro Alpha - a UI test automation framework now supports WebGL, besides PC and Mobile, and we need early adopters to test it",https://www.reddit.com/r/webgl/comments/qscipf/altunity_pro_alpha_a_ui_test_automation_framework/,,[]
How to automate delivering builds to testers via Discord: Tutorial,https://www.reddit.com/r/gamedev/comments/wotms9/how_to_automate_delivering_builds_to_testers_via/,"Getting your game build to testers and stakeholders could be tedious if you do this manually every time. As a result, people end up going for bigger commits or sending build less often – both things are suboptimal. So, ideally delivery to testers and stakeholders should be automated. Here's a tutorial on how to automate delivering builds and release notes to testers via public dashboards or a Discord channel. We did it for a Unity app with a simple workflow on Codemagic CI/CD.","['What benefits does this have over just say... using Steam to distribute private builds to testers? Steam has the added advantage of auto-updates and most devs are probably going to put their game on Steam anyway, so it saves a step.', ""Well you see, the issue with that is that OP and his company aren't getting paid then."", ""You can use the workflow described in the article for Android and iOS games as well, where Steam is just irrelevant.For PC games, you can happily use either of the approaches: be it Steam or Discord. What's important here is automation: as long as you can automate publishing to Steam's Playtest and notifying testers, you save yourself a lot of time."", 'Wow, this seems interesting. I have used Slack integration before, but discord sounds better. Thanks!', 'Does your website support Unreal too? Or just Unity?', ""On the one hand, we only have Unity preinstalled.On the other hand, if you find a way to use Unreal in a CI environment (and I guess there are some ways, I just haven't tried them out), Codemagic would work for you just as well.""]"
How do QA Automation Roles in Web Dev compare to video game QA?,https://www.reddit.com/r/cscareerquestions/comments/46xfi1/how_do_qa_automation_roles_in_web_dev_compare_to/,"I grew up doing manual video game QA, and eventually moved up in to QA Management and then Production. A while back, I made the transition in to web development (Rails, JS, React, etc), but have been struggling to find an entry level job. However, I've gotten a few hits from companies looking for entry level QA Automation Engineering roles.My question is, for those of you who do QA Automation, how do you feel about it? Personally, I loved video game QA - I would have done it forever if the pay scaled up enough. When I'm making my own projects/apps, I TDD everything, and always write extensive (for a beginner) test plans. I like seeing the tests turn from red to green, it feels like I'm accomplishing things.I enjoy creating things on my own, but I think I would be happy working on my own personal projects on my own time, and writing tests for other's software for profit. I'm at a bit of a crossroads here and am hoping to hear from some other QA Automation folks to get a better understanding of how the job is.Thank you!edit: Thanks, everyone. I've got an interview next week, so I'll keep that and ask a ton of questions.","[""I think that your perception of the job will heavily depend on your interests. I tend to find my job writing test scripts a bit monotonous, since I always seem to be using the same tools and solving the same problems. For me, there aren't a ton of redeeming qualities, because I don't have a strong interest in testing. But it seems like you have taken an interest in writing test cases (which is a large part of the job), so it's entirely possible that you will enjoy QA automation a lot more than I do.Here's a list of QA related things that I do to give you a bit more of an idea about my day-to-day responsibilities:write test cases for the application"", ""It honestly depends. I'm in QA automation, specifically automating ui testing using the selenium api in c#, and honestly..... It's really boring. It isn't really challenging in the slightest once you get the hang of the api. But some of the guys I work with love that. Oh, and we only program 20% of the time. So if you think that you would be comfortable with that and not want to jump over to dev, then go for it. Me, I'm looking to move to a dev role asap."", ""You get to make real money.Video game QA really sucks in terms of salary and stability. As a game tester you're always waiting for the game to end, the studio doesn't line a new one up and everyone is fired.Even with F2P games that don't really ship, you just find out one day your losing too much money and the party is over.""]"
PowerAutomate run history: How do you deal with the fact that it only keeps the flows run history for 28 days ? Sometimes it's not enough. I would love to have it keep the history for longer. And manually saving CSV files every month is not feasible (not to mention it's not so visual).,https://www.reddit.com/r/PowerApps/comments/whbanu/powerautomate_run_history_how_do_you_deal_with/,,"['For flows important to monitor, like data sync flows with external API’s etc. I have created a logging table. All flow executions are logged, with the status, so succes, errors, warnings, the number of changed items and so on.I can just look at the table and see exactly what the last execution for the account sync did, how many accounts are updated etc.This also solves the problem for when flows are disabled when they are failing for x number of times. By logging the failed execution, the flow is always ending in succes.', ""I'd appreciate seeing some screenshots of what you're explaining here, this sounds great. Are you using dataverse for your logging tables? Are you writing your logs just as a last action of each flow? I'm interested in learning more about error handling in general with flow, latest issue is that I'll take SharePoint list item and try to write it to another list, if one of the columns is blank, I get errors because of a null value, so I have to check everything for null first, very annoying and inefficient IMO."", 'Ok, so lets start with a generic flow, this flow pulls all changed relations from an external API, using a custom connector.Image 1 - general overview of the flowI start by defining the API definition. I manually create an object, and define the corresponding optionset values. This allows me to copy / paste the definition and the  succes / error handing records. I only have to define the fields once per flow, and can copy / paste the items acros other flows.I parse the json object so I can just select the defined fields.', 'Thanks for sharing. I would definitely like to learn more about your method. If you feel screenshots will help me understand it better, please share them!', 'If you click ""Improve my Flow"" on the flow detail page, Process Advisor will create a dataflow of the run history step by step in Dataverse.You can set the dataflow refresh whenever you like. I combine all of ours into a dataflow in PBI and incrementally refresh to keep a full history.Don\'t forget to rename the dataflow.', 'This seems to be way above my knowledge..Can you expand more on it? Perhaps share some screenshots?', 'I rely on the the Flow Service API to query run history.', 'Hey there /u/thekhristyCan you expand on that please?I dont know much about the Flow Service API and how I would do such a query.', 'Another option would be to use logic apps which will run for 90 days by default.', 'For mission critical things like emailed an invoice to a client, I make the flow write back for the dataverse. If I miss a failed flow run, I’ll see there are still pending emails to send on my dashboard.', 'If you want something canned that you can do with every flow, stick the entire flow inside a scope box. This will allow you to use the results() expression. Results() will give you the success/fail of everything that happened inside that scope box. Then you can be as clever or as simple as you want after that. Can do parallel branches and configure ""run after"" settings for each side to record a failure, or you can parse the array of results() for failure and use a conditional. Tons of options, but it starts with getting your flows in some consistent structure to be able to report on.ETA: Look up the Powerapps center of excellence. The tool is being migrated overtime into standard admin features to be able to use charting to see flow health etc.', 'If you want something canned that you can do with every flow, stick the entire flow inside a scope box.This sounds interesting. Thanks.Someone else in reddit suggested scopes as well.', 'JavaScript', 'It will usually update sharepoint list updates / generate mails which will be stored or history is kept.Also approval history is stored.So enough history to retrieve.']"
"AltUnity Pro Alpha - a UI test automation framework now supports WebGL, besides PC and Mobile, and we need early adopters to test it",https://www.reddit.com/r/unity/comments/qscgkn/altunity_pro_alpha_a_ui_test_automation_framework/,https://altom.com/altunity-pro-alpha/,[]
Created web app that has automated twitter tools to grow/manage account. TwitMan,https://www.reddit.com/r/Twitter/comments/tvghhp/created_web_app_that_has_automated_twitter_tools/,"Wanted to share my web app TwitMan that has tools to help you grow and manage your twitter.I built this using Next JS and Auth is handled through twitter via Next-Auth.If you think it's cool, leave a star on the GitHub!",[]
"Taking google's python it automation course on coursera, looking for advice on what to do after",https://www.reddit.com/r/PinoyProgrammer/comments/z3hwek/taking_googles_python_it_automation_course_on/,"(repost from r/TechCareerShifter since I didn't get responses there)I'm halfway through this certificate program (Google IT Automation with Python Professional Certificate) specifically.(I should also mention I did not finish my degree in HRIM, and I'm looking into this kasi di na ako makakashift within my uni and di ko talaga alam kung gusto ko tapusin program ko)Curious lang ako, sapat na ba yung ganitong certificate to get a job as a junior/apprentice python dev? From what I read the answer is probably ""haha no"" pero kung ganoon, what would you suggest to make myself look more appealing to potential employers? I hear stuff about contributing to projects on github to build up experience but that sounds kind of vague to me as someone with zero experience before taking this course.I'm also looking into taking this course for full-stack software dev from IBM, would it be helpful for trying to land a job? Sorry if these questions sound dumb, but I really don't know where to start hahaha","['Just keep applying for jobs even as you learn. Getting a job is a numbers game. IMHO, apply to 30 jobs a day for 30 days.Also, try to get freelance gigs. Those are easier to get and it will give you some experience on actual projects.Kahit libreng pagawa ng website ng kapit bahay mo, Wala namang makakalam na libre lang yun e. Hehehe', 'learning without applying is useless, as other OP said, after what you learn, what you can offer?, have you try to apply what you learn', 'I have a certificate from coursera (IOT) pero feeling ko mababaw siya kung bilang palit sa degree or Bragging rights lang man.Siguro to be appealing sa mga company , create a program, app etc na pwede mo maidemo or maipakita sa kanila to showcase your capability.', 'what would you suggest to make myself look more appealing to potential employers?For entry level company jobs or even for freelance....definitely, portfolio.No idea what projects to do?  Just Youtube it.  Type ""python automation projects"".', 'Answer this: After you finished that course and get that shiny certificate — what can you offer based on what you’ve learned?If you can’t answer that, then I hate to break it to you but you are putting yourself in the world of pain. 😂Kidding aside, don’t think too much just focus on learning things. Certificate alone won’t gonna cut it.', 'learn basic databases OP (excel or NoSQL)or basic HTML, CSS, JS tapos apply mo po yung natutunan mo sa Python, tapos highlight mo po how you use Python on that website or databaseBale yan po magiging laman ng portfolio mo']"
"Having a smart home & looking like a dumbass for standing in a friend’s kitchen repeating, “Turn on the kitchen lights” before being reminded their house isn’t automated, so I have to first find the wall switch & then physically alter its position. How inconvenient.",https://www.reddit.com/r/firstworldproblems/comments/wdfqp3/having_a_smart_home_looking_like_a_dumbass_for/,,"['Best way to handle appearances: Let out a heavy sigh and give a pointed look at the homeowner as you turn on the light.', 'I did this an a hotel room a few weeks ago! You are not alone.', 'Too wordy', 'Alexa, zip it.']"
how to automate screen brightness level based on light luminous from webcam?,https://www.reddit.com/r/Windows11/comments/ycpaif/how_to_automate_screen_brightness_level_based_on/,How to please?,[]
"Senior Manager, Email Marketing Automation @ WebMD",https://www.reddit.com/r/EmailJobs/comments/uyxlzx/senior_manager_email_marketing_automation_webmd/,"📨 New job: Senior Manager, Email Marketing Automation @ WebMD👉 Read more @ https://www.emailjobs.io/jobs/senior-manager-email-marketing-automation-at-webmd",[]
"How to use a DSLR camera as a ""web cam"" for live streaming?",https://www.reddit.com/r/NoStupidQuestions/comments/z188pv/how_to_use_a_dslr_camera_as_a_web_cam_for_live/,"I want to do a live stream around the holidays (playing my guitar) and I kmow theres a way to use a DSLR camera to record a live stream by connecting it to a computer, I've been trying anything I can think of and I did get a capture card (a cheap one since Im broke) to try that, and nothing. Would love some help, thanks!","[""i don't have a DSLR but if it connects to a monitor or such via micro or mini HDMI you could hook it up to a capture card via a cable, my camcorder let's me do it""]"
How vildhjarta automates pitch shifting to write riffs (lavender haze cover),https://www.reddit.com/r/vildhjarta/comments/wbvgub/how_vildhjarta_automates_pitch_shifting_to_write/,,"['Damn I never realized that one harmonic was pitched differently from the chugs it exists between. Playing like this seems super difficult though, you have to be absolutely perfectly on time for it to work. The accuracy of our boys is insane.', ""Machine-like precision is key. In an episode of the Riffhard podcast, Buster Odeholm said that all the guitar parts are highly edited to make the timing as perfect as possible.It isn't necessarily as hard to physically play as it is to fully internalize what's going on technically and musically, and for that to fully sink in. Once you get a feel for how automated pitch shifting changes your available notes, it feels actually quite natural."", 'Nice! What did you do for drums?', 'The part you recorded for this has to be my favorite motif on the record.', 'Stems?🥺', 'This is interesting.  When you say pitch shift -5… are you saying 5 half steps?  5 whole steps?', 'Usually 5 semitones, so yeah half steps', 'Aww man that is so cool. So with this being that much harder to play accurately, how does it sound live?']"
How to do LinkedIn automation without spamming?,https://www.reddit.com/r/marketing/comments/w3mt0j/how_to_do_linkedin_automation_without_spamming/,"LinkedIn automation tools are wonderful for locating new prospects and then developing relationships. With the right technology, users may search for and locate qualified persons to add to their sales funnel.Certain leads may be eliminated quickly as a result of this. LinkedIn automation tools can save you a lot of time. You don’t want to waste any of the 8 to 10 hours of a workday on a potentially unsuccessful new venture.Establishing and using LinkedIn automation tools takes only a few minutes per day. The case that individuals use LinkedIn to connect with others distinguishes it. They’ve already got entry. A LinkedIn invitation is significantly more reachable than an email or a cold call.Users can build customized messages with stand-ins for up to 100 new invitations to be issued immediately using the LinkedIn automation application Linkedcamp. It also allows you to schedule follow-up messages, which eliminates the need to manually process follow-ups with much more than 100 contacts — which is time-consuming if they don’t respond.Users can focus on connecting with customers and building relationships. Linkedcamp prevents being “spammy” because of its personalized approach, which boosts the possibility of attracting qualified leads.","[""If this post doesn't follow the rules report it to the mods.I am a bot, and this action was performed automatically. Please contact the moderators of this subreddit if you have any questions or concerns."", ""I always automate everything - on every platform possible. But LinkedIn isn't one of them - at least when using your professional profile. The stakes of being banned are too high. LinkedIn automation works only when you make your tool - not for commercial tools. LinkedIn employees buy these available for everyone's software and make them useless by tracing its footsteps on the net and when someone uses them - the system instantly bans them because they use the same steps on platform as the automation would.""]"
